mhy_id,name,introduction,effect,label
1,火,火元素附着：火元素属性的攻击，可能会使生物附着火元素。火元素与其他元素交汇时，也可能会引发元素反应,热诚之火：冰元素附着的持续时间下降40%。攻击力提升25%。,element
2,水,水元素附着：水元素属性的攻击，可能会使生物附着水元素。水元素与其他元素交汇时，也可能会引发元素反应,愈疗之水：火元素附着的持续时间下降40%。受治疗效果提升30%。,element
3,草,草元素附着：草元素属性的攻击，可能会使生物附着草元素。草元素与其他元素交汇时，也可能会引发元素反应,蔓生之草：元素精通提升50点。触发燃烧、原激化、绽放反应后，队伍中附近的所有角色元素精通提升30点，持续6秒。触发超激化、蔓激化、超绽放、烈绽放反应后，队伍中附近的所有角色元素精通提升20点，持续6秒。以上效果的持续时间独立计算。,element
4,雷,雷元素附着：雷元素属性的攻击，可能会使生物附着雷元素。雷元素与其他元素交汇时，也可能会引发元素反应,强能之雷：水元素附着持续时间下降40%。触发超导、超载和感电反应时，有100%概率掉落1个雷元素微粒，冷却时间5秒。,element
5,风,扩散：风元素与一些元素交汇时，可能引发扩散！扩散能造成对应元素的伤害，产生附着，或进一步引发其他反应,迅捷之风：体力消耗降低15%，移动速度提升10%，技能冷却时间缩短5%。,element
6,冰,冰元素附着：被冰元素攻击集中的话，会附着冰元素属性。并使移动速度降低。冰元素与其他元素交汇时，也可能会引发元素反应,粉碎之冰：雷元素附着持续时间下降40%。攻击冰元素附着或冻结状态下的敌人时，暴击率提高15%。,element
7,岩,结晶：岩元素与一些水/火/雷/冰元素接触时，会发生结晶反应！这种反应能产生对应元素的晶片，能为角色提供各种元素护盾！利用结晶反应，可以有效降低战斗中受到的伤害,坚定之岩：护盾强效提升15%。角色处于护盾保护状态时，造成的伤害提升15%，对敌人造成伤害时会使敌人的的岩元素抗性降低20%，持续15秒。,element