mhy_id,name,eng_name,nick_name,army,introduction,label
1,蒙德,Mondstadt,自由之邦、风之国度、牧歌之城、蒲公英的国度,西风骑士团,蒙德是游戏《原神》及其衍生作品中的一个国家。位于提瓦特大陆的北边。蒙德是提瓦特大陆七国中的一个城邦。蒙德城四面被果酒湖包围，只有一座石桥与外界连接，在城市的最深处是一座宏伟的大教堂，名为西风大教堂，教堂外的广场上竖立着风神巴巴托斯的雕像。数千年前蒙德曾由尘世七执政中的风神巴巴托斯管理，但为了自由的风神放弃治理，只在蒙德由旧贵族统治的腐败时期进行过协助。当今实质的管理者是西风骑士团。蒙德位于提瓦特大陆东北部的自由城邦。群山和广袤的平原间，自由之风携着蒲公英的气息吹拂过果酒湖，为坐落于湖心岛上的蒙德城送去风神巴巴托斯的祝福与恩泽。,country
2,璃月,Liyue,千岩军,契约之城、商业之都,璃月是游戏《原神》及其衍生作品中的一个国家，是提瓦特大陆七国中的一国。在七国中以岩为信仰。璃月港是全提瓦特大陆最繁华且吞吐量最大的港口，其黄金屋也是全提瓦特统一货币摩拉的唯一制造所。璃月位于提瓦特大陆东方的富饶港湾。傲然矗立的山麓与石林、广袤的平原与生机勃勃的河滩共同构成了璃月的丰富地貌，在四季分明的气候下焕发出多彩的风华。也是魔神战争最激烈的地方。山石奇景间，埋藏着无尽的岩之魔神的古老馈赠等待着人们发掘。,country
3,稻妻,Inazuma,,幕府军、珊瑚宫军,稻妻是游戏《原神》及其衍生作品中的国家，是提瓦特大陆七国中的一国，位于提瓦特大陆远东的封闭群岛。在七国中信仰雷元素力，统治者为信奉永恒的雷电将军巴尔泽布。原型为闭关锁国的日本幕府时期。稻妻，永恒的国度，日语中即闪电之意，是位于提瓦特大陆远东的封闭群岛。稻妻外海被雷霆骤雨所包围，越过无尽的雷暴，踏上红枫与绯樱眷顾的诸岛，在环绕的砂堤、高耸的断崖与幽秘的山林之中，见证御建鸣神主尊大御所大人所追寻的永恒。,country
4,至冬,Snezhnaya,至冬国,愚人众,至冬，冰神所统治的国度，其势力愚人众分布大陆各地。,country
5,须弥,Sumeru,雨林之国、智慧之国、学城之都,镀金旅团,须弥，是游戏《原神》及其衍生作品中的7个国家之一，位于璃月的西侧，是草木的国度。须弥分为雨林和沙漠两大部分，沙漠位于须弥城的西方，被称为大赤沙海。须弥是智慧的国度，须弥人对智慧与知识的探求是永无止境的。须弥拥有葱郁雨林与荒芜沙土的奇异国度，无数智慧的果实在这里生长、埋葬。无论是穿越丛林踏上学城的台阶，还是深入沙漠挖掘赤土的遗迹，远道而来的旅者都可以在此获取宝贵的智识。,country
6,枫丹,Fontaine,暂无,暂无,枫丹，是游戏《原神》及其衍生作品中的国家，提瓦特大陆七国中的一座城邦。在七国中信仰「水」元素力。信奉的神明为掌管“正义”的水之神芙卡洛斯。枫丹是提瓦特大陆中的一个国家，由水之神“芙卡洛斯”统治的国度，取名于法国枫丹白露市镇，枫丹人对艺术及时尚、以及正义有着极致追求。,country
7,纳塔,Natlan,暂无,暂无,纳塔，是游戏《原神》及其衍生作品中的国家，提瓦特大陆七国中的一座城邦，为火元素之国。,country
